id	sentence	id_tr	sentence_tr
2748541	2012 жылдын казан айында корган каласында оган ота жасалып, жарты жыл емделгеннен кейин отбасымен казакстанга оралды.	2748544	В октябре 2012 года ей провели операцию в Кургане, и спустя полгода лечения весной семья вернулась в Казахстан.
2748545	Миленага тагы бирнеше сауыктыру курсын отуге тура келеди, бирак даригерлер бари жаксы болады деп болжап отыр.	2748546	Милене придётся пройти ещё несколько реабилитационных курсов, но прогнозы врачей хорошие.
2748547	казир Милена кабыргага немесе ата-анасына суйенип, акырындап журе бастады.	2748548	Милена уже понемногу ходит, опираясь на стену или родителей.
2748549	Егер уакытында ота жасалмаганда, онын еки аягын да кесип алып тастауга тура келетин еди.	2748550	Если бы тогда не была сделана операция, ей бы пришлось ампутировать обе ноги.
2748554	Сондай-ак, Айша Бексултаннын да калы жаксарып келеди, кыз баланын журегинде акауы болган, оган Украинада ота жасалып, жакында елге оралды.	2748555	Так же хорошо идут дела у Айшы Бексултан - у девочки был порок сердца, и ей была сделана операция на Украине, откуда она недавно вернулась.
2748556	Тагы сондай журек акауы бар Аяулым курбановага да ойдагыдай ота жасалды.	2748557	Успешно была прооперирована Аяулым Курбанова, у которой также был порок сердца.
2748558	Тагы торт баланы емдеуди кР Денсаулык сактау министрлиги оз бакылауына алып отыр.	2748559	Что касается ещё четверых детей, то их лечение находится под контролем Министерства здравоохранения РК.
2748561	Естеринизге сала кетейик, 2012 жылдын кыркуйек айында Лондон Олимпиадасынын чемпионы Александр Винокуров сол айтулы сайыста жениске жеткен велосипедин аукционга койган болатын.	2748562	Напомним, в сентябре 2012 года олимпийский чемпион Лондона Александр Винокуров выставил на аукцион велосипед, на котором он одержал победу.
2748563	"Топтаманы Tak Group компаниясы 243 мын долларга сатып алды, сондай-ак, спортшынын киими жане ""Астана"" велокомандасынын керек-жарактар жиынтыгы сатылды."	2748564	"Лот за 243 тысячи долларов приобрела компания Tak Group, также были проданы форма спортсмена и комплект экипировки велокоманды ""Астана""."
2748565	Сатудан тускен барлык каражат наукас балаларды емдеуге жумсалды.	2748566	Все средства, вырученные от продажи, пошли на лечение тяжелобольных детей.
2748567	Винокуровтын окилдери балалар жиберилген емдеу орындарына кажетти сомаларды тикелей толеп берди.	2748568	Представители Винокурова напрямую оплачивали необходимые суммы в клиниках, куда отправляли детей.
2793632	Аныкталган акау тез арада жойылуы керек.	2793633	Обнаруженный брак подлежит немедленному устранению.
2793639	Бундай окигаларга аскери ис-кимыл, табиги немесе апат жагдайлар, индет, тауарды жеткизуге карантин жане эмбарго сиякты арекет жатады, бирак ол тек осы окигалармен шектелмейди.	2793641	Такие события могут включать, но не ограничиваться действиями, такими как: военные действия, природные или стихийные бедствия, эпидемия, карантин и эмбарго на поставку товара.
2793644	Мемлекеттiк сатып алулары туралы келiсiм шарты корcетiлген келiсiм шарты бойынша орындалган толык орындауды шартта кабылданган мiндеттемелердiн тапсырма берушiмен жане жабдыктаушысымен болып есептеледi.	2793645	Договор о государственных закупках считается исполненным при условии полного выполнения заказчиком и поставщиком принятых обязательств по указанному договору.
2793672	Осы Конвенцияга косымша онын ажырамас болiгi болып табылады жане осы Конвенцияга кез келген сiлтеме осы косымшага сiлтеменi де бiрдей билдiредi.	2793673	Приложение к настоящей Конвенции является её неотъемлемой частью, и любая ссылка на эту Конвенцию равно означает и ссылку на это приложение.
2802333	улыбританиянын Стаффордшир графтыгына карайтын Стоук-он-Трент елди мекениндеги аулие Петр атындагы католик ширкеуи жергиликти мусылман жамагатына сатылды.	2802334	Здание католической церкви святого Петра, в Стоук-он-Трент, в графстве Стаффордшир, Великобритания, продано местной мусульманской общине.
2802336	2007 жылдын алеуметтик зерттеу натижелерине караганда, британдыктардын 15 пайызы ширкеуге тек айына бир-ак рет ат изин салады екен.	2802339	По данным социологического опроса 2007 года лишь 15 процентов британцев раз в месяц посещают церковь.
2802341	озге дерек коздери бойынша улыбритания ширкеуге келетин жамагаты жагынан кари курлыкта тортинши ел болып табылады.	2802344	По данным других исследований, Великобритания занимает четвертое место снизу по посещаемости церквей.
2802345	Солтустик казакстан облысынын «Барс-Агро» шаруа кожалыгынын егис даласында бидай толтырылган бункерди босату кезинде, айналып турган шынжырга абайсызда илинип калган «Лукбанов» ЖШС 43 жастагы механизаторы мерт болды.	2802350	"В Северо-Казахстанской области на полевом стане крестьянского хозяйства «Барс-Агро» при разгрузке бункера, наполненного пшеницей, по неосторожности зацепившись за цепь крутящего вала шнека, погиб 43-летний механизатор ТОО ""Лукбанов""."
2802359	костанайда мотокросс бойынша Кеден одагынын Кубогы ушин жарыс болып отти.	2802361	В Костанае состоялись соревнования по мотокроссу на Кубок Таможенного союза.
2802364	Жарыска алты команда, онын ишинде ресейлик корган каласынын окилдери де катысты.	2802366	В состязаниях участвовали шесть команд, в том числе из российского города Курган.
2802368	катысушылар жасынын артурлилиги оларды - жасоспиримдерден ардагерлерге дейинги алты артурли санатка болуге мумкиндик берди.	2802369	Разновозрастной состав участников позволил представить их в шести различных классах гонщиков - от юниоров до ветеранов.
2802370	Жарыстын ен жас катысушысы 7 жастагы булдиршин.	2802371	Самому юному участнику чемпионата исполнилось всего 7 лет.
2802372	узындыгы 1600 метрден туратын арнайы мотожол корермендерге осы кызыкты сайысты толыгымен тамашалауга мумкиндик берди.	2802373	Специальная мототрасса, длина которой составляет 1600 метров, позволила многочисленным зрителям наблюдать спортивное зрелище во всей его полноте.
2802379	Тарихи билимсиз казакстандык отансуйгиштик болмак емес, ал отансуйгиштик болмаса, сындарлы миндеттерди шешуде барша улттын топтасуы ари биригуи болмайды.	2802381	Без знания истории не может быть казахстанского патриотизма, а без патриотизма немыслимы консолидация и единение всей нации для решения судьбоносных задач.
2802392	Буырканган, кунделикти аумалы-токпели омирлик жагдайда, онын устине елимиздин улт кошбасшысы айкындап берген жогары мектеп жуйесиндеги жана межелер билим беру жуйеси алдына жана миндеттер жуктейди.	2802396	В условиях бурно меняющейся жизни, в том числе новых задач в системе высшей школы, обозначенных Лидером нашей страны, перед системой высшего образования стоят новые задачи.
2802401	Сиздин козкарасынызша, «кошпели» уакытты кыскарту ушин жогары буын мамандарын дайындау жуйесинде биринши кезекте дурыс, ыкпалды ари накты кандай кадам жасау кажет?	2802403	Какие, по Вашему мнению, верные, действенные и точечные шаги необходимо сделать в первую очередь в системе подготовки специалистов высшего звена, чтобы сократить «переходное» время?
2802407	Жогары билим беру жуйесинин басты максаты - алемдик денгейге карай илгери басу.	2802408	Главная цель системы высшего образования - продвижение к мировому уровню.
2802418	казакстан дамуынын жаһандык максаттарына сайкес биздин жогары мектеп жуйемиз алемдик санаттагы университтерди калыптастыруды, алемдик денгейдеги мамандарды дайындауды камтамасыз етуге багытталган.	2802420	В соответствии с глобальными целями развития Казахстана система нашей высшей школы нацелена на формирование университетов мирового класса, обеспечение выпуска специалистов с мировым уровнем подготовки.
2802427	Биздин ис-кимылдарымыздын басты максаттары 2020 жылга дейин Л.Н.Гумилев атындагы Еуразия улттык университетинин даму стратегиясын жузеге асыру болып саналады.	2802428	Главными направлениями нашей деятельности являются реализация Стратегии развития Евразийского национального университета имени Л.Н. Гумилева до 2020 года.
2802434	Ал бул реттеги басты миндеттер мыналар: козделген стратегиялык багыттарды жузеге асыруды жалгастыру, жумыс берушилердин муктаждыгын зерделеу жолымен биздин тулектеримиздин басекеге кабилеттилигин арттыру, окытудын инновациялык адистерин колдану, ЕуУ студенттеринин гылыми-зерттеу кызметтеринин тужырымдамасын дайындау, касипорындарда кафедра филалдарын куру бойынша жумыстарды жандандыру, китапхана ресурстарынын электронды курамдас болигин жетилдиру, гылыми мектептердин кызметин олардын кызметтеринин коммерциялану натижелери тургысында белсендиру.	2802435	И здесь основные задачи: продолжение реализации предусмотренных стратегических направлений; повышение конкурентоспособности наших выпускников путем изучения потребностей работодателей, применения инновационных методов обучения; разработка концепции научно-исследовательской деятельности студентов ЕНУ; активизация работы по созданию филиалов кафедр на предприятиях; совершенствование электронной составляющей библиотечных ресурсов; активизация деятельности научных школ в плане коммерциализации результатов их деятельности.
2802439	Университетте Назарбаев университети улгиси бойынша баскарудын корпоративтик жуйесин кенинен енгизу тетиги азирленуде, 2014 жылдан бастап ЖОО-га кезен-кезенмен дербестик беру карастырылуда, 2012 жылдан бастап бизде заннамалык тургыда зор окилеттик бекитилген байкаушы кенеси жумыс истейди.	2802440	В университете разрабатывается механизм широкого внедрения корпоративной системы управления по типу Назарбаев Университета, прорабатывается переход к предоставлению автономии вузу поэтапно - с 2014 года; с 2012 года у нас функционирует наблюдательный совет с большими законодательно установленными полномочиями.
2802442	казакстан Республикасынын Президенти Н.Назарбаев озинин «казакстан - 2050» Стратегиясы» атты халыкка Жолдауында укиметке стратегиялык инновациялык багыттар бойынша шетелдик гылыми-зерттеушилик когамдастыкпен казакстандык галымдардын куш-жигерин ыкпалдастыруга жане жаһандык технологиялык тонкеристин болшегине айналуга мумкиндик беретин аукымды халыкаралык гылыми-зерттеу жобаларына белсенди катысу тетиктерин азирлеуди тапсырган болатын.	2802443	Президент Республики Казахстан Н.А. Назарбаев в своем Послании народу Стратегия «Казахстан - 2050» поручил Правительству выработать механизм активного участия в масштабных международных научно-исследовательских проектах, которые дадут возможность интегрировать усилия ученых Казахстана с зарубежным научно-исследовательским сообществом по стратегическим инновационным направлениям и стать частью глобальной технологической революции.
2802445	Л.Н.Гумилев атындагы Еуразия улттык университетинин гылыми-зерттеу кызмети басымдыкты салаларда иргели гылымдар мен колданбалы изденистерди дамытуга багытталган.	2802448	Научно-исследовательская деятельность Евразийского национального университета имени Л.Н.Гумилева направлена на развитие фундаментальной науки и прикладных изысканий в приоритетных областях.
2802452	ЖОО-нын гылыми-зерттеу жумыстарында Инженерлик бейимдеги зертхана (будан ары - ИБЗ) мен Инновациялык парк кызмети ерекше орынга ие.	2802453	Особое место в научно-исследовательской работе вуза занимает деятельность Лаборатории инженерного профиля (далее - ЛИП) и Инновационного парка.
2802456	ИБЗ кР БгМ тарабынан базалык каржыландыруга ие жалгыз курылым болып саналады.	2802457	ЛИП является единственной структурой, имеющей базовое финансирование со стороны МОН РК.
2802462	ИБЗ базасында дипломдык жумыстарды, магистрлык диссертацияларды жане гылыми жумыстарды орындау жузеге асырылады.	2802464	На базе ЛИП осуществляется выполнение дипломных работ, магистерских диссертаций и научных проектов.
2802466	ЖОО жумысынын манызды корсеткиштеринин бири - гылыми жарияланымдарда, асиресе, Тhomson Reuters жане Scopus малиметтер базасына киретин рейтинги жогары журналдарда жарияланымдарды жарыкка шыгаруы.	2802468	Одним из важнейших показателей работы вуза является публикация в научной периодике, в особенности публикации в высокорейтинговых журналах, входящих в базы данных Thomson Reuters и Scopus.
2802470	Аталган корсеткиш бойынша сонгы жылдардын ишинде он серпин байкалып отыр.	2802471	По данному критерию за последние годы также наблюдается положительная динамика.
2802473	кР Президенти Н.а.Назарбаевтын уш тилдиликти дамыту бойынша тапсырмасын орындау ари алемдик билим беру жуйесине киригудин келеси манызды факторы - бирнеше тилди жетик менгерген кадрлар дайындау.	2802477	Другим важным фактором интеграции в мировую образовательную систему и выполнения поручения Президента РК Н.А. Назарбаева по развитию триединства языков является подготовка многоязычных кадров.
2802480	Бул ушин откен оку жылынан бастап-ак билим алушылардын жалпы курамымен арнайы болимшелер ашылуда.	2802481	Для этого уже с прошлого учебного года открываются специального отделения с общим контингентом обучающихся.
2802482	Аталган болимшелердеги билим беру багдарламаларынын курылымы былайша калыптастырылган: гуманитарлык пандер - тарих, адебиет жане баскалары мемлекеттик тилде окытылады, ал жаратылыстану гылымдары пандери - химия, математика, физика, биология агылшын тилинде жургизиледи.	2802490	Структура образовательных программ на этих отделениях построена таким образом, чтобы гуманитарные дисциплины - история, литература и другие преподавались на государственном языке, а естественнонаучные дисциплины - химия, математика, физика, биология - будут преподаваться на английском языке.
2802492	Будан ары мундай арнайы болимшелердин саны жане олардын курамы арттырылатын болады.	2802493	В последующем число таких специальных отделений и их контингент будут увеличиваться.
2802494	алемдик билим беру кенистигине ыкпалдасудын тагы бир манызды компоненти академиялык уткырлыкты дамыту деп санаймыз.	2802495	Не менее значительным компонентом интеграции в мировое образовательное пространство мы считаем развитие академической мобильности.
2802496	Еки жылдын ишинде Л.Н.Гумилев атындагы ЕуУ-дын 30-дан астам магистранттары мен докторанттары еки дипломды билим беру багдарламасы бойынша уздик шетелдик университеттерде билим алу мумкиндигине ие болды.	2802498	За два года свыше 30 магистрантов и докторантов ЕНУ имени Л.Н.Гумилева получили возможность обучиться в лучших зарубежных университетах по программе двудипломного образования.
2802499	казакстандагы «академиялык уткырлык» багдарламасы барынша ерекше.	2802501	В Казахстане проект «академическая мобильность» достаточно уникален.
