id	sentence	id_tr	sentence_tr
437352	Алматылыктар, балалар ушин мейиримди кала жасайык!	437356	Алматинцы, создадим город, дружественный к детям!
437364	Ерекше атап от!	437367	Отметь по-особому!
437373	Сименс. Биз ар жануяга кажетпиз.	437375	Сименс. Мы нужны каждой семье.
437381	Алматы - менин суйикти калам!	437382	Алматы - мой любимый город!
437393	Олар бизден барлык кагаз жумысты озине алды.	437395	Они отобрали у нас всю бумажную работу.
437411	Жана жылынызбен!	437406	С Новым годом!
437419	Интернет пен телефонды бир жинакта сатыл ал!	437421	Купи интернет и телефон в одном пакете!
437426	Сен МЕТРО-да жумыс истегин келе ме?!	437429	Ты хочешь работать в МЕТРО?!
437434	кош келдиниздер!	348097	Добро пожаловать!
437440	Сен даретхана!	437441	Ты туалет!
437445	Алдын ала толемсиз ал да, артык толемсиз толе.	437449	Бери без предоплаты, плати без переплаты.
437451	Биздин кушимиз - бирликте!	437452	Наша сила - в единстве!
438568	Жака куйылган — ен бастысы.	438569	Свежесть на первом месте.
438571	Еркин озинде болсын!	438572	Будь собой!
438574	Батар куннин атар таны бар.	438575	У каждого дня есть продолжение.
438577	Биздин тарифтеримиз азайтылды!	438578	Наши тарифы стали меньше!
438580	Жогары билим сапасы ен жогары халыкаралык талаптарга жауап беруи тиис.	438581	Качество высшего образования должно отвечать самым высоким международным требованиям.
438583	азир тамак жок.	438586	Сейчас нету еды.
438587	Мынау ким?	438589	Это кто?
438595	Бул казакстанда жасалган.	438597	Это сделано в Казахстане.
438601	Бул тамак.	438602	Это еда.
457805	Бул Брайан Рок.	457794	Это Брайан Рок.
509821	Салем.	402430	Здравствуй.
509821	Салем.	466968	Привет!
797259	Мен Жапонияда турамын.	426122	Я живу в Японии.
811585	Бугин сенбi.	468424	Сегодня суббота.
888646	Бiлемiн.	607512	Я знаю.
1356844	Ол озенде батып кетти.	1356734	Он утонул в реке.
1356847	Бугин абетке не жейсин?	1355391	Что ты будешь сегодня на обед?
1356848	Газет кайда?	1354600	Где газета?
1356849	Бул бугинги газет пе?	1352480	Это сегодняшняя газета?
1356850	казир сонгы штрихты енгиземин.	1352489	Сейчас я внесу последний штрих.
1356852	Ол козилдирик киеди.	497523	Он носит очки.
1356855	Кеше не болганы есинде жок па?	1350985	Ты не помнишь, что случилось вчера?
1356860	Том - солакай, бирак ол он колымен жазады.	1350904	Том - левша, но он пишет правой рукой.
1356864	колындагы не?	1350893	Что у тебя в руке?
1356870	колым лас болган сон жуып турмын.	570138	Я мою руки, потому что они грязные.
1356871	Ол онын колынан устады.	1350885	Он взял её за руку.
1356872	Сурак кою ушин колын котерди.	1350883	Он поднял руку, чтобы задать вопрос.
1356874	Бул факттар менин гипотезамды растайды.	1349578	Эти факты подтверждают мою гипотезу.
1356877	Мен аш ормекшимин.	1348666	Я голодный паук.
1356878	айелиммен кенессем ештене етпей ме?	1348636	Ничего, если я обсужу это с женой?
1358687	Мен ериншекпин.	1357122	Я ленивый.
1358693	Олар бир сыныптан.	1356895	Они из одного класса.
1358696	Менде айтатын созим жок.	5419	У меня нет слов.
1358703	Туган кунинмен, Мюриэл!	5414	С днём рождения, Мюриэл!
1358712	Бугин 18 маусым, енди бул Мюриэлдин туган куни!	5413	Сегодня 18 июня, и это день рождения Мюриэл!
1358714	Бул не?	5412	Что это?
1358715	Не истеп отырсын?	5411	Что ты делаешь?
1358717	Кунине 1000 евро табыс табамын.	5433	Я зарабатываю сто евро в день.
1358719	Бул ештенени де озгертпейди.	5431	Это ничего не изменит.
1358730	Бул жана фотография ма?	5424	Это новая фотография?
1358733	Не айтарымды да билмеймин.	5421	Не знаю, что и сказать.
1358739	Мен оларга ертен согамын, уйге келген сон.	5443	Я позвоню им завтра, когда вернусь домой.
1358744	Мен сени сагындым.	5442	Я скучаю по тебе.
1358747	окинишке орай, бул шындык.	5454	К сожалению, это правда.
1358748	Ешкашан биологияны жаксы корген емеспин.	5451	Я никогда не любил биологию.
1358749	Мен былай омир суре алмаймын.	5449	Я так жить не могу.
1358750	Кеттим.	5446	Я пойду.
1358761	Сенимдисин бе?	5460	Ты уверен?
1358764	Бул менин жауабым!	5458	Это мой ответ!
1358777	Жок, мен емес, сен!	5457	Нет, не я, а ты!
1358781	Мен оны атып тастаймын.	5475	Я пристрелю его.
1358785	оскен сон, патша болгым келеди.	5471	Когда я вырасту, я хочу стать королём.
1358788	Бул контекстиге байланысты.	5467	Это зависит от контекста.
1358800	Мен тек айтым отырмын!	5477	Я всего лишь говорю!
1358811	Уакытта аркашан да табуга болады.	5492	Время всегда можно найти.
1358817	Дал солай.	5490	Так оно и есть.
1358822	канша жакын достарын бар?	5488	Сколько у тебя близких друзей?
1358829	Неге сурап турсын?	5502	Почему ты спрашиваешь?
1358835	Бул кызык.	5513	Это интересно.
1358839	Адамдар манги омир суре алмайды.	5510	Люди не могут жить вечно.
1358843	Сен тусинбейтин проблема бар.	5524	Есть проблема, которую ты не понимаешь.
1358851	Бул маган унаган жок.	5520	Мне это не нравилось.
1358859	Бул манызды емес.	5519	Это не важно.
1358871	Не айткын келип турганынды тусинип турган жокпын.	5542	Я не понимаю, что ты имеешь в виду.
1358872	Не болып калды?	5539	Что случилось?
1358874	Тусиндиргенине рахмет.	5537	Спасибо за объяснение.
1358877	Ешким билмейтин болады.	5555	Никто не узнает.
1358882	Енди не истеримди билмеймин.	5576	Я уже не знаю, что делать.
1358884	Сонша коп кутким келмейди.	5572	Я не хочу ждать так долго.
1358887	Мен сени жаксы корем.	5568	Я люблю тебя!
1358888	Мен сени суйемин.	5568	Я люблю тебя!
1358894	Мени ешким тусинбейди.	5614	Никто меня не понимает.
1358897	Мен жапонша сойлей алмаймын.	5612	Я не говорю по-японски.
1358904	Мысык? - деп сурады карт адам.	5626	Кошка? - спросил пожилой мужчина.
1358908	отинем, жыламашы.	5620	Пожалуйста, не плачь.
1358910	Мумкин емес!	5619	Не может быть!
1358918	Бул маган оте унайды.	5634	Мне это очень нравится.
1358918	Бул маган оте унайды.	1517319	Это мне очень нравится.
1358920	Менин атым Джек.	5633	Меня зовут Джек.
1358923	Менин есимим Джек.	5633	Меня зовут Джек.
1358927	Мектепке баргым келмейди.	5654	Я не хочу идти в школу.
1358931	Сеники дурыс.	5650	Ты прав.
1358933	Дурыс айтасын.	5650	Ты прав.
1358947	Олар бизден кагазбен жасайтын барлык жумысты тартып алды.	437395	Они отобрали у нас всю бумажную работу.
1358954	казир тамак жок.	438586	Сейчас нету еды.
1358959	Жогары билим сапасы ен жогары халыкаралык талаптарга сайкес болуы тиис.	438581	Качество высшего образования должно отвечать самым высоким международным требованиям.
1358969	Неликтен?	694104	Почему?
1485959	Мен дукенге барып жатырмын.	1485952	Я иду в магазин.
1496122	Маган аудармашы керек.	1389779	Мне нужен переводчик.
1517242	Ештен кеш жаксы.	414464	Лучше поздно, чем никогда.
1517271	Жаркыраганнын бари алтын емес.	381304	Не всё то золото, что блестит.
1517271	Жаркыраганнын бари алтын емес.	1517274	Не все золото, что блестит.
1517367	Баска пале тилден.	1517368	Язык мой - враг мой.
1517371	Билими жок ул – жупары жок гул.	1517373	Человек без знаний - всё равно что цветок без запаха.
1517376	Тазалык - денсаулык кепили.	1517382	Чистота - залог здоровья.
1517391	кайырлы кун!	1517389	Добрый день!
1517404	казанда метро бар.	404359	В Казани есть метро.
1517421	акем - агылшын тили мугалими.	1516241	Мой папа - учитель английского языка.
1517424	Бир, уш жане бес - так сандар.	385746	Один, три и пять — это нечётные числа.
1517444	Менде бир ага жане еки карындас бар.	424937	У меня один старший брат и две младшие сестры.
1517447	Менде бир ага жане еки синли бар.	424937	У меня один старший брат и две младшие сестры.
1518117	Биздин халкымызга ен кереги - бирлик, ултаралык татулык пен саяси турактылык.	1518118	Самое необходимое для нашего народа - единство, межнациональное согласие и политическая стабильность.
1518377	Полиция окига туралы бизге малимет берди.	902759	Полиция информировала нас о происшествии.
1518381	Полиция окига туралы бизге хабарлады.	902759	Полиция информировала нас о происшествии.
1518392	Дуйсенби – ауыр кун.	1518393	Понедельник - день тяжёлый.
1518471	Бiзде кантарда кар ушкындап турады.	337615	У нас в январе идёт снег.
1518472	Жылдын бiрiншi айы - кантар.	467757	Первый месяц года - январь.
1518473	Бугiн екiншi кантар.	826404	Сегодня второе января.
1518477	кантар, акпан, наурыз, сауiр, мамыр, маусым, шiлде, тамыз, кыркуйек, казан, караша жане желтоксан жылда он екi айларын курайды.	1398135	Январь, февраль, март, апрель, май, июнь, июль, август, сентябрь, октябрь, ноябрь и декабрь составляют двенадцать месяцев в году.
1518486	Аш бала ток баламен ойнамайды.	1518487	Голодный ребёнок с сытым не играет.
1518822	Жумыс таулик бойы истеледи.	1518823	Работа идёт круглосуточно.
1519680	АкШ-та аскери ушак тургын уйге кулады	1519677	В США военный самолёт упал на жилой дом.
1519694	Бугин Дуйсенби.	407793	Сегодня понедельник.
1519727	Менде электрогитара бар.	1519726	У меня есть электрогитара.
1520140	казак тили - ана тилим.	1520142	Казахский язык - мой родной язык.
1520144	Мен Шымкентте турамын.	1520147	Я живу в Шымкенте.
1520169	Мен курылысшымын.	1520170	Я - строитель.
1520173	Сен кайда барасын?	1520174	Ты куда идёшь?
1520175	Сиз кашан базарга барасыз?	1520176	Вы на базар когда пойдёте?
1520200	Мен билмеймин.	414650	Я не знаю.
1520204	Сен мени тындайсын ба?	1444703	Ты меня слушаешь?
1520206	Сиз оны билесиз бе?	639264	Вы его знаете?
1520206	Сиз оны билесиз бе?	1520208	Вы знаете его?
1520209	Ол кайда жумыс истейди?	1520210	Он где работает?
1520209	Ол кайда жумыс истейди?	2734717	Где она работает?
1520212	Емтиханга дайындалап отырмын.	1520213	Я готовлюсь к экзамену.
1520214	Ол спортпен шугылданады.	1520215	Он занимается спортом.
1520216	Мен китаптарымды жазамын.	1520217	Я пишу книги.
1520218	"Менин айелим ""Арзан"" дукенинде сатушы болып жумыс истейди."	1520219	"Моя жена работает продавщицей в магазине ""Арзан""."
1520220	Сизге жардем беруге бола ма?	1520221	Я могу Вам помочь чем-нибудь?
1520237	Ертен типти ешкайда бармаймын.	1520238	Завтра я вообще никуда не пойду.
1520239	Мен уйимде каламын.	1434123	Я останусь дома.
1520242	Бул маган унап тур.	1520244	Мне это нравится.
1520908	иним мектепке кетти.	1520910	Мой младший брат ушёл в школу.
1520913	Шешем зауытта истейди.	1520914	Моя мама работает на заводе.
1520916	Бугин кун ашык.	1520917	Сегодня ясный день.
1520916	Бугин кун ашык.	1520921	Сегодня ясная погода.
1520918	Кун буркип тур.	1520919	Идёт мелкий дождь.
1520922	Пойыз жай журеспин кетти.	1520923	Поезд поехал тихим ходом.
1520926	Олар мейманханага жайгасты.	1520925	Они расположились в гостинице.
1520927	Олар конак уйге жайгасты.	1520925	Они расположились в гостинице.
1520928	Биреудин айтуымен жазгым келеди.	1520930	Я хочу писать под диктовку.
1520931	Тастагы ески жазулары.	1520933	Древние надписи на камне.
1520935	Мен ешкайсысын танымаймын.	1520936	Я никого не знаю.
1520939	индет коп елди жайлады.	1520940	Эпидемия распространилась на многие страны.
1520943	Ешкандай менин досым емес.	1520944	Никакой он мне не друг.
1520945	Ертеде ушактар болмаган.	1520946	В старые времена не было самолётов.
1520947	кар ериди.	1520948	Снег растаял.
1520951	Коктем келди.	1520952	Весна пришла.
1520957	Мен одан ертерек келдим.	1520960	Я пришёл раньше, чем он.
1520957	Мен одан ертерек келдим.	1520963	Я пришёл раньше него.
1520965	Енди дем алуга болады.	1520966	Теперь можно отдохнуть.
1520967	Бул адетке енди.	1520968	Это вошло в привычку.
1520970	ан ауени жагымды естиледи.	1520971	Слышится приятная мелодия.
1520972	Лайым солай болсын.	1520973	Желаю, чтобы всегда было так.
1520974	Созинин манызы жок.	1520975	В его словах нет смысла.
1520974	Созинин манызы жок.	1520976	Он говорит бестолково.
1520979	Мен осыны ескертуге мажбурмин.	1520980	Я вынужден тебя об этом предупредить.
1520984	Ол жумыска немкурайды карайды.	1520985	Он к работе относится халатно.
1520988	омири оналып келеди.	1520989	Жизнь налаживается.
1520990	олтирдин гой мени.	1520991	Ты убил меня своим поступком.
1520996	Ол оз миндеттерине салак карады.	1520998	У него было халатное отношение к своим обязанностям.
1521708	Бугин мен ерте турдым.	1521709	Сегодня я рано встал.
1521715	"Жалкаудын ""ертени"" ешкашан таусылмайды."	1521719	"У лентяя ""завтра"" никогда не кончается."
1521725	Биз ески патерде турамыз.	1521727	Мы живём в старой квартире.
1521923	Ол саудырлап согып отыр.	1521925	Он говорит громко и без умолку.
1521927	Жанбыр саулап куйып тур.	463358	Дождь льёт как из ведра.
1522986	Аттыга жаяу жолдас болмас.	1522987	Конный пешему не товарищ.
1522991	Отан – елдин анасы, ел – ердин анасы.	1522992	Родина - мать народу, народ - мать джигиту.
1522993	аркимнин оз жери – жумак.	1522994	Каждому его родная земля - рай.
1522996	Туган жердей жер болмас, туган елдей ел болмас.	1522998	Нет земли лучше Родины, нет людей лучше, чем на Родине.
1522999	Ел иши – алтын бесик.	1523000	Родная земля – золотая колыбель.
1523001	Тамшы тас жарады,тил бас жарады.	1523003	Капля камень расколет, а слово – голову.
1523006	Тил - килти конилдин.	1523008	Язык - ключ к душе человека.
1523010	откен кун оралмас, кунды соз жогалмас.	1523011	Прожитый день не вернется, а мудрое слово останется.
1523021	Жаксы соз жарым ырыс.	1523022	Доброе слово – половина блага.
1523025	Жуздин корки – коз, ауыз корки.	1523026	Глаза украшают лицо, уста - слово.
1523028	Жаксы соз - жан азыгы.	1523030	Хорошее слово – душе опора.
1523034	акеге карап ул осер.	1523035	Глядя на отца растёт сын.
1523036	Бие коп болса, кулын коп.	1523038	Когда кобылиц много, и жеребят много.
1523040	Акшада коз жок.	1523041	У денег глаз нет.
1523044	Алтынды тот баспайды.	1523046	Золото не ржавеет.
1523047	Акша ашпайтын кулып жок.	1523049	Нет того замка, который бы устоял против денег.
1523051	калтасында тиыны жок, туйенин тисин ашып кореди.	1523052	В кармане ни гроша, а сам заглядывает в зубы верблюда.
1523055	Базар акшалыга базар, акшасызга назар.	1523056	Базар с деньгами – базар, а без денег какой базар.
1523057	Жаксы айел жаман еркекти хан кылады.	1523058	Хорошая женщина и плохого мужика ханом сделает.
1523060	Балалы уй - базар, баласыз уй - мазар.	1523062	Дом полный детей - как базар, дом без детей - тих как могила.
1523064	Досты периште косады, куданы кудай косады.	1523066	С другом сводит ангел, со сватом сводит сам Бог.
1523068	Жети рет олшеп, бир рет кес.	548116	Семь раз отмерь, один раз отрежь.
1523074	Енбектин козин тапкан, байлыктын озин табады.	1523075	Кто найдёт источник труда, тот найдёт и само богатство.
1523077	Бир жылга коян териси де шыдайды.	1523078	Один год и заячья шкура выдержит.
1523080	айелдин акылы - коркинде, еркектин корки - акылында.	1523082	Ум женщины - в её красоте, красота мужчины - в его уме.
1526942	Ханымдар мен мырзалар!	1526943	Дамы и господа!
1526949	Осакада кар жауып турды.	1526798	В Осаке шёл снег.
1527211	Жыланнын уы басында болады, бейгамнын жауы касында болады.	1527212	Яд змеи - в голове, враг ротозея - рядом с ним.
1527229	уй тар, сырт кар.	1527230	В доме тесно, на дворе - снег.
1527231	Мен типти сени ашуланар деп ойлаган жок едим.	1527232	Я даже и не думал, что ты рассердишься.
1527239	Олар согыста каза болгандарды аскери дастур бойынша койып еди.	1527243	Погибших в бою они похоронили по военной традиции.
1527245	Ол коре койды.	1527249	Он заметил сразу же.
1527254	Ол жудырыкпен койып жиберди.	1527258	Он ударил кулаком.
1527264	Ол бар кымызды котарып ишип койды.	1527265	Он залпом выпил весь кумыс.
1527269	Тау тауга косылмайды, адам адамга косылады.	1527272	Гора с горой не сходится, а человек с человеком сходится.
1527275	Онын пикирине мен де косыламын.	1527280	Я тоже присоединяюсь к его мнению.
1527286	корыкканга кос коринеди.	1188686	У страха глаза велики.
1527296	Коз коркак, кол батыр.	652057	Глаза боятся — руки делают.
1527302	Ол коркуды билмейди.	1527303	Он не знает страха.
1527302	Ол коркуды билмейди.	1527304	Он не ведает страха.
1527306	Ол жерди корыс кылып казды.	1527308	Он разворотил землю.
1527310	Ол мыс корытады.	1527312	Он плавит медь.
1527319	Шоби козгама.	416643	Не трогай траву.
1527322	козгама.	1017057	Не трогай.
1527325	Гулдерди козгама.	1058895	Не трогай цветы.
1527330	Ол уадесинде турмайтын адам екен.	1527332	Он, оказывается, не держит своего слова.
1527336	Мен созимде турдым.	1527339	Я сдержал своё слово.
1527342	когамдык сананы когамдык турмыс билейди.	1527344	Общественное бытие определяет общественное сознание.
