id	sentence	id_tr	sentence_tr
2075116	ушакты айдап акетушилер ату жазасына кесилди.	2075117	Угонщики самолёта были приговорены к расстрелу.
2075120	кылмыскерлер ушкыштар кабинасына сынган балдактын комегимен кирип, жарылгыш затты иске коспакшы болды, делинеди сот малимдемесинде.	2075121	Преступники хотели проникнуть в кабину пилотов с помощью сломанного костыля и привести в действие взрывное устройство, говорится в заявлении суда.
2075122	Бул кылмыста еки кудикти азамат ауруханада коз жумды.	2075123	Двое подозреваемых в этом преступлении скончались в больнице.
2075124	Шымкенттен Новосибирге багыт алган, ишинде 22 жолаушы отырган халыкаралык автобус жырага тусип кетти.	2075125	Съехал в кювет международный автобус с 22 пассажирами, следовавший из Шымкента в Новосибирск.
2075126	каза тапкандар мен зардап шеккендер жок.	2075127	Жертв и пострадавших нет.
2075128	Астанада еки бала иис тиип уланды.	2075129	В Астане отравились угарным газом двое детей.
2075130	Олар ауруханага жеткизилди.	2075131	Они госпитализированы.
2075130	Олар ауруханага жеткизилди.	2075132	Они отправлены в больницу.
2075133	Павлодарлык археологтардын кешендик гылыми экспедициясы облыс аумагындагы казба жумыстары кезинде табылган бирегей олжаларды усынды.	2075134	Комплексная научная экспедиция павлодарских археологов презентовала уникальные находки, обнаруженные при раскопках на территории области.
2075135	Сонгы жылдардын ишинде биринши рет далалык Ертис манынын коне тарихынын дауирлерин корсеткен колеми бойынша айтарлыктай улкен материал алынды.	2075136	Впервые за последние несколько лет был получен значительный по объёму научный материал, отражающий целые эпохи древней истории степного Прииртышья.
2077893	Ол улды болды.	2077894	Она родила сына.
2077897	Саби 12 желтоксанга караган туни дуние есигин ашты.	2077898	Малыш появился на свет в ночь на 12 декабря.
2077899	Шакалактын салмагы 3,5 кели, бойы 51 см.	2077900	Вес новорожденного - 3,5 килограмма, рост 51 сантиметр.
2077902	Бугин ол ауруханадан шыгады.	2077903	Сегодня её выпишут из больницы.
2077902	Бугин ол ауруханадан шыгады.	2077904	Сегодня его выпишут из больницы.
2078291	Астана калалык сотында жана тагайындаулар болды.	2078293	В городском суде Астаны произведены новые назначения.
2078311	«Эйр Астана» компаниясы 2002 жылы курылган.	2078316	Компания «Эйр Астана» основана в 2002 году.
2078337	Актауда 12.12.12-де 41 жуп некелерин киды.	2078340	12.12.12 в Актау образовалась 41 семья.
2078361	адебиет пен онер саласынын уздиктери Президенттин колынан Мемлекеттик сыйлыктарды алды.	2078369	Президент наградил государственными премиями деятелей литературы и искусства.
2078403	10 актобелик азамат «Жыл адамы» атагына ие болды.	2078409	10 актюбинцев удостоены звания «Человек года».
2078423	Марапатталгандардын тизими ресми баспасозде жарияланды.	2078428	Список награждённых был опубликован в официальной прессе.
2078515	Дарис аякталган сон Тауелсиз казакстан мен онын Тунгыш Президенти туралы китаптармен таныстыру расими отти.	2078516	По завершении лекции были презентованы книги о Независимости Казахстана и его Первом Президенте.
2079822	Бугин Мемлекет басшысы казакстан халкына Жолдауын жариялайды.	2079824	Сегодня Глава государства выступит с Посланием народу Казахстана.
2079827	Н. Назарбаев казакстаннын 2050 жылга дейинги даму багдарламасын жариялайды.	2079828	Н. Назарбаев огласит программу развития Казахстана до 2050 года.
2079830	Сколковода казакстан-Ресей инновациялык ынтымактастыгынын болашагы талкыланды.	2079831	В Сколково обсудили перспективы казахстано-российского инновационного сотрудничества.
2079833	кР Премьер-Министри ЕурАзЭк Бас хатшысымен кездесу откизди.	2079835	Премьер-Министр РК провёл встречу с Генеральным секретарём ЕврАзЭС.
2092349	Биз сатсиздиктерден корыкпаймыз!	2092350	Мы не боимся неудач!
2092351	Биз кателиктерден сабак аламыз.	2092352	Мы учимся на ошибках.
2092353	Биз аркашан алга умтылып, жана белестерди багындыруга талпынамыз.	2092354	Мы всегда стремимся двигаться вперёд и осваивать новые горизонты.
2092355	Жогары биликтилик белестерине апаратын кажырлы енбек «биик шындарды багындыру» жолындагы кулшынысынды арттырады.	2092356	Упорный труд, обеспечивающий высокий уровень компетенции, является непременным условием того, что придет ощущение возможности «покорить любые вершины».
2092357	Биз Сизбен ынтымактас болуга куанамыз!	2092358	Мы будем рады сотрудничеству с Вами!
2092359	Биз ардайым оз жумысымызда озимиздин клиенттеримиздин пикирлери мен талап-тилектерин нысанага алып, олардын умиттерин толыкканды канагаттандыруга тырысамыз.	2092360	В своей работе мы всегда ориентируемся на мнение и пожелания наших клиентов и стараемся в полной мере удовлетворить их ожидания.
2092362	кызмет аткарган жылдар ишинде биз оз сериктестеримизбен изги де жылы карым-катынас орнаттык.	2092363	За годы нашей деятельности у нас сложились добрые и тёплые отношения с нашими партнёрами.
2092364	Биз оларга оз алгысымызды билдире отырып, ары карай да сериктестигимиз жемисти ари бирлескен жумысымыз жалгасады деп умиттенемиз.	2092365	Мы выражаем им свою признательность и надеемся на дальнейшее плодотворное сотрудничество и продолжение нашей совместной работы.
2092366	Белсенди ари узак мерзимди сериктестикке умит артамыз!	2092367	Надеемся на активное и долгосрочное сотрудничество!
2092368	Биз ардайым жана сериктестерге куанамыз!	2092369	Мы всегда рады новым партнёрам!
2092370	Биз озимиздин клиенттеримиз бен сериктестеримизбен туракты байланыстамыз жане олардын кобисимен узак мерзимди озара тиимди ынтымактастык кура алгандыгымызды мактаныш тутамыз.	2092371	Мы поддерживаем постоянную связь со своими клиентами и партнёрами и гордимся тем, что со многими из них у нас сложилось долгое взаимовыгодное сотрудничество.
2092372	откен жылдар бойынша биздин агенттик жуздеген уйымдар мен мындаган жеке тулгаларга оз кызметин усынды.	2092373	За прошедшие годы наше агентство предоставило свои услуги сотням организаций и тысячам физических лиц.
2092375	Жогары сапалы кызмет корсете отырып, клиенттердин барлык кажеттиликтерин барынша канагаттандыруга тырысамыз.	2092376	Мы стремимся максимально удовлетворить все потребности клиентов, предоставляя высокое качество оказываемых услуг.
2092377	Бизбен аркашанда бирге болган клиенттеримиз бен сериктестеримизге алгыс билдиремиз!	2092378	Мы благодарим наших клиентов и партнёров, кто был рядом с нами всё это время!
2092379	Егер биздин кызметимизге катысты сурактарыныз болса немесе мамандардан тусиниктеме алгыныз келсе, онда томендеги улгини толтырып, сурак койыныз.	2092380	Если у вас возникли вопросы относительно нашей деятельности, или вы хотите получить комментарии специалиста, задайте вопрос, заполнив предложенную ниже форму.
2094946	Ол жии арак ишкенди унатады.	2094947	Он любит часто закладывать за воротник.
2094946	Ол жии арак ишкенди унатады.	2094948	Он любит часто напиваться.
2094952	Мен cурет салуды унатамын.	1892346	Я люблю рисовать.
2094962	казакстанда кукык коргау органдарынын жогары лауазымдарына тагайындалатындар арнайы курылымнын тексеруинен отеди.	2094978	В Казахстане будет сформирована специальная структура для проведения проверок при назначении на высшие должности в правоохранительные органы.
2095109	Онтустик казакстан - казактын каймагы бузылмаган жер.	2095111	Южный Казахстан – непоколебимая основа казахов.
2102578	Адам болып туган сон, адам болып олу керек.	2102579	Родившись человеком, надо и умереть человеком.
2102580	Адамдыктан улкен ат жок, наннан улкен ас жок.	2102581	Самая святая пища - хлеб, самое святое имя - человек.
2102582	Ел иши - алтын бесик.	2102583	Родная земля - золотая колыбель.
2102584	Ерликте корлык жок.	2102585	Мужеству позор неведом.
2102586	Отан ушин курес - ерге тиген улес.	2102587	Мужская доля - за Родину стоять.
2102588	Адамнын сырты алдамшы.	2102589	Внешность человека бывает обманчива.
2102590	Заманына карай заны, тогайына карай аны.	2102591	По лесу и звери, по времени и законы.
2102592	Адамга адам жат емес.	2102593	Человек не родился врагом человеку.
2102594	Кисини кейде таршылык сынайды, кейде баршылык сынайды.	2102595	Достоинство человека иногда нужда проверяет, а иногда и достаток.
2102596	Куйесиз казан жок, кайгысыз адам жок.	2102597	Нет котла без сажи, а человека - без печали.
2102598	Адам тастай берик, гулдей назик.	2102599	Человек крепче камня и нежнее цветка.
2102600	Шешилмеген шиени тырнак шешпес, тил шешер.	2102601	Узел, непосильный рукам, по силам языку.
2102602	Туган жердин жуасы да татти.	2102603	И дикий лук на родной земле сладок.
2102604	Ормансыз жер - жаланаш, армансыз ер - жаланаш.	2102605	Человек без мечты, что земля без леса - пуст.
2102606	Талабы жок жас - канаты жок кус.	2102607	Человек без цели, что птица без крыльев.
2102634	Ашканнан кейин банкини тоназыткышта бир тауликтен асырмай сактау керек.	2102636	После вскрытия банку хранить в холодильнике не более суток.
2102639	Кун саулесинен сактаныз.	2102640	Беречь от солнечных лучей.
2102645	Дайындалган кунинен бастап он еки ай жарамды.	2102648	Годен двенадцать месяцев с даты изготовления.
2102649	Баланы тамактандырар алдында банкинин ишиндегисин араластырыныз.	2102650	Перед кормлением ребенка содержимое баночки перемешать.
2102651	Дайындалган кунин какпагынан караныз.	2102652	Дату изготовления смотрите на крышке.
2102653	ондирилген куни мен жарамдылык мерзимин банкинин какпагынан караныз.	2102654	Дату производства и срок годности смотрите на крышке банки.
2102655	оним курамында аздаган молшерде жангак болуы мумкин.	2102656	Продукт может содержать незначительное количество орехов.
2102657	оним курамында аздаган молшерде жержангак, жангак жане глютен болуы мумкин.	2102658	Продукт может содержать незначительное количество арахиса, орехов и глютена.
2102659	(18±3) °С температурада жане ауанын салыстырмалы ылгалдылыгы 75 %-дан аспайтын жерде сактау керек.	2102660	Хранить при температуре (18±3) °С и относительной влажности воздуха не более 75 %.
2102661	кара шоколадтын курамында какаонын жалпы кургак калдыгы – 49,5%.	2102662	Шоколад тёмный содержит общий сухой остаток какао - 49,5%.
2102663	Ресейде ондирилген.	2102664	Произведено в России.
2102666	0°C-тан +25°C-ка дейинги температурада жане ылгалдылыгы 75%-дан аспайтын кургак, салкын жерде сактау керек.	2102667	Хранить в сухом, прохладном месте при температуре от 0 °C до +25 °C и влажности не более 75%.
2102668	Ашканнан кейин бирден пайдаланыныз.	2102669	Употребить сразу после вскрытия.
2102670	Пайдаланар алдында кыздыруга шыдамды ыдыска салып, жылытыныз да, араластырыныз.	2102671	Перед употреблением рекомендуется переложить в термостойкую посуду, разогреть и перемешать.
2102672	Тамактандырганнан кейин калган жылытылган онимди сактауга болмайды.	2102673	Разогретый продукт, оставшийся после кормления, хранению не подлежит.
2102674	оним Тутынушы кукыктары мен адам саулыгын коргау саласындагы кадагалау жониндеги федералдык кызметтин санитарлык-эпидемиологиялык сараптамасынан откен.	2102675	Продукт прошёл санитарно-эпидемиологическую экспертизу в Федеральной службе по надзору в сфере защиты прав потребителей и благополучия человека.
2102676	Сегиз айдан аскан балаларга пайдалануга кенес бериледи.	2102677	Рекомендуется детям старше восьми месяцев.
2102678	оним курамында аздаган молшерде балдыркок болуы мумкин.	2102679	В составе продукта может быть незначительное количество сельдерея.
2102680	Жарамдылык мерзими - ондирилген кунинен бастап 12 ай.	2102681	Срок годности - 12 месяцев с даты изготовления.
2102682	Зарарсыздандырылган жане асептикалык капталган оним.	2102683	Продукт стерилизован и асептически упакован.
2135207	колданушыларга арналган бул бирегей мумкиндик суйикти телеарналарынызды тамашалау денгейин арттырады.	2135208	Это уникальная возможность для пользователя повысить уровень комфорта и удобства при просмотре любимых телеканалов.
2135212	Сойтип, империя кезенинде казакстанда телекоммуникацияны дамыту ушин негизи салынды.	2135213	Таким образом, в имперский период была заложена основа для развития телекоммуникаций в Казахстане.
2135216	Революцияга дейинги кезенде казакстан телефон абоненттеринин жалпы саны мыннан аспайтын еди.	2135217	Общее количество телефонных абонентов Казахстана в дореволюционный период было меньше тысячи.
2135218	кабылданган шаралар кери удеристи токтатуга жане болашак жумысынын негизин калауга мумкиндик берди.	2135220	Принятые меры позволили отчасти затормозить негативные процессы и заложить основы будущей работы.
2135222	казакстан дуние жузилик экономикага шыга бастады.	2135223	Казахстан начал интеграцию в мировую экономику.
2135224	Бул сала бойынша елимиздин коптеген корсеткиштермен жогары орындарга шыгуына мумкиндик берген биздин экономикамыздын стратегиялык манызды курамдарынын бири болуга алгашкы кадам болды.	2135226	Это был первый шаг к становлению одной из стратегически важных областей нашей экономики, который позволил вывести страну на высокие места по многим показателям в отрасли.
2137388	Майлы, ащы, тузды тагамдарды жемеуге тырысыныз.	2137389	Старайтесь не есть жирную, острую и солёную пищу.
2137390	Тениздин аргы жагы жылырак, ал бизде жарыгырак.	2137391	За морем теплее, а у нас светлее.
2137392	Торгай екеш торгай да оз уясын коргайды.	2137393	Воробей и тот своё гнездо охраняет.
2137394	Отан отбасынан басталады.	2137395	Родина начинается с семьи.
2137396	Тамырсыз жусан да оспейди.	2137397	Без корня и полынь не растёт.
2137398	озиннин гажайып Отанынды умытпа, оз туган жерине ешкашан сокпай отпе.	2137399	Свою Родину прекрасную никогда не забывай, места, где ты родился, никогда не обходи.
2137400	Отаныннын ар агашы кулимдеп турады.	2137401	На Родине каждое дерево улыбается.
2137402	Халыктын уни зенбиректердин думпуинен куштирек.	2137403	Голос народа сильнее грохота пушек.
2137404	ар кустын оз уясы озине кымбат.	2137405	Для каждой птицы своё гнездо дорого.
2157152	ушак бортында болган барлык адамдар каза тапты.	2157156	Все люди, находившиеся на борту самолёта, погибли.
2228665	Ол тилегин орындата алмай сагы сынды.	2228667	Не удовлетворили его просьбу и он опустил руки.
2229551	Ауыз куысынын кутими алгашкы тис шыкканга дейин басталады.	2229564	Уход за полостью рта необходимо начинать ещё до прорезывания первого зуба.
2229571	Тис алты айлык жастан бастап осе бастайды.	2229578	Зубы начинают появляться в шесть месяцев.
2229598	Тис даригерине бир жаска толганга дейин корсетиниз.	2229604	До исполнения ему одного года покажите его врачу-стоматологу.
2229615	Тамактандырганнан кейин кызыл иекти ылгалды сулгимен суртиниз.	2229618	После кормления протирайте дёсны влажной салфеткой.
2229686	Ол курайда жаксы ойнайды.	2229688	Он хорошо играет на курае.
2271089	Ол обырдан кайтыс болды.	1621410	Он умер от рака.
2271170	1986 жылы турли-тусти айелдердин улттык институты АкШ-тагы турли-тусти айелдердин улттык кунин бекитти.	2271176	Национальный день цветных женщин был установлен Национальным институтом цветных женщин США в 1986 году.
2277519	Анкау байкамайды, анги тындамайды.	2277521	Рассеянный не заметит, глупый не поймёт.
